{
  "schema": "date-v3-design-v1",
  "design_id": "FM256",
  "kind": "network",
  "family": "FM",
  "nodes": 256,
  "async": true,
  "routing": "mesh",
  "lane_profile": "mesh-1",
  "top_mesh_lanes": 0,
  "cluster_grid": null,
  "router_primitives": [
    {
      "primitive_id": "async_flatmesh_1x1",
      "level": 1,
      "child_lanes": 1,
      "parent_lanes": 1,
      "use_mesh_routing": true,
      "count": 256
    }
  ],
  "expected_structure": {
    "routers": 256,
    "ports": 1280,
    "adapters": 0,
    "interlevel_fifos": 0,
    "top_ports": 0,
    "max_opm_fanin": 4,
    "mutex_widths": [
      4
    ]
  },
  "flit_width_bits": 28,
  "buffer_slots": 5,
  "no_uturn": true,
  "interlevel_fifo": "bypass",
  "clock_ns": null,
  "hrep_policy": false,
  "shares_netlist_with": null,
  "paired_trace_with": null,
  "adapter": null,
  "paper_role": "Asynchronous flat mesh network, 256 nodes",
  "paper_eligible_default": true,
  "notes": "",
  "delay_recipe": {
    "rcu_steps": 1,
    "rcu_unit_ps": 150,
    "buf_stages": 0,
    "ackin_steps": 1,
    "ackin_unit_ps": 50,
    "ackin_use_buf": false
  },
  "display_name": "Asynchronous flat mesh network, 256 nodes",
  "display_description": "16-by-16 asynchronous flat mesh. Compared with the 256-node hierarchical network at the same node count."
}
