{
  "schema": "date-v3-design-v1",
  "design_id": "PROP64",
  "kind": "network",
  "family": "PROP",
  "nodes": 64,
  "async": true,
  "routing": "quadtree_topmesh",
  "lane_profile": "1-2-2-2",
  "top_mesh_lanes": 2,
  "cluster_grid": 1,
  "router_primitives": [
    {
      "primitive_id": "async_fat_1x2",
      "level": 1,
      "child_lanes": 1,
      "parent_lanes": 2,
      "use_mesh_routing": false,
      "count": 16
    },
    {
      "primitive_id": "async_prop_2x2",
      "level": 2,
      "child_lanes": 2,
      "parent_lanes": 2,
      "use_mesh_routing": false,
      "count": 4
    },
    {
      "primitive_id": "async_prop_2x2",
      "level": 3,
      "child_lanes": 2,
      "parent_lanes": 2,
      "use_mesh_routing": false,
      "count": 1
    }
  ],
  "expected_structure": {
    "routers": 21,
    "ports": 146,
    "adapters": 264,
    "interlevel_fifos": 0,
    "top_ports": 2,
    "max_opm_fanin": 8,
    "mutex_widths": [
      2,
      4,
      5,
      8
    ]
  },
  "flit_width_bits": 28,
  "buffer_slots": 5,
  "no_uturn": true,
  "interlevel_fifo": "bypass",
  "clock_ns": null,
  "hrep_policy": false,
  "shares_netlist_with": null,
  "paired_trace_with": null,
  "adapter": null,
  "paper_role": "Asynchronous balanced hierarchical network, 64 nodes",
  "paper_eligible_default": true,
  "notes": "",
  "delay_recipe": {
    "rcu_steps": 1,
    "rcu_unit_ps": 150,
    "buf_stages": 0,
    "ackin_steps": 1,
    "ackin_unit_ps": 50,
    "ackin_use_buf": false
  },
  "display_name": "Asynchronous balanced hierarchical network, 64 nodes",
  "display_description": "64-node asynchronous hierarchical network with the locked 1-2-2-2 lane profile."
}
