{
  "schema": "date-v3-design-v1",
  "design_id": "HREP1024",
  "kind": "network",
  "family": "HREP",
  "nodes": 1024,
  "async": true,
  "routing": "quadtree_topmesh",
  "lane_profile": "1-2-2-2",
  "top_mesh_lanes": 2,
  "cluster_grid": 4,
  "router_primitives": [
    {
      "primitive_id": "async_fat_1x2",
      "level": 1,
      "child_lanes": 1,
      "parent_lanes": 2,
      "use_mesh_routing": false,
      "count": 256
    },
    {
      "primitive_id": "async_prop_2x2",
      "level": 2,
      "child_lanes": 2,
      "parent_lanes": 2,
      "use_mesh_routing": false,
      "count": 64
    },
    {
      "primitive_id": "async_prop_2x2",
      "level": 3,
      "child_lanes": 2,
      "parent_lanes": 2,
      "use_mesh_routing": false,
      "count": 16
    },
    {
      "primitive_id": "async_topmesh_2x2",
      "level": 1,
      "child_lanes": 2,
      "parent_lanes": 2,
      "use_mesh_routing": true,
      "count": 16
    }
  ],
  "expected_structure": {
    "routers": 352,
    "ports": 2496,
    "adapters": 4864,
    "interlevel_fifos": 0,
    "max_opm_fanin": 8,
    "mutex_widths": [
      2,
      4,
      5,
      8
    ]
  },
  "flit_width_bits": 28,
  "buffer_slots": 5,
  "no_uturn": true,
  "interlevel_fifo": "bypass",
  "clock_ns": null,
  "hrep_policy": true,
  "shares_netlist_with": "PROP1024",
  "paired_trace_with": null,
  "adapter": null,
  "paper_role": "Boundary packet-replication comparison; shares the 1024-node hierarchical netlist",
  "paper_eligible_default": true,
  "notes": "",
  "delay_recipe": {
    "rcu_steps": 1,
    "rcu_unit_ps": 50,
    "mesh_rcu_unit_ps": 150,
    "buf_stages": 0,
    "ackin_steps": 1,
    "ackin_unit_ps": 50,
    "ackin_use_buf": false
  },
  "display_name": "Asynchronous balanced hierarchical network, 1024 nodes, boundary packet-replication comparison",
  "display_description": "Same gate netlist and delay file as the 1024-node balanced hierarchical network. Only the injection policy splits a cross-cluster multicast into unicast copies."
}
