{
  "schema": "date-v3-design-v1",
  "design_id": "PFAT64",
  "kind": "network",
  "family": "PFAT",
  "nodes": 64,
  "async": true,
  "routing": "quadtree_topmesh",
  "lane_profile": "1-2-4-8",
  "top_mesh_lanes": 8,
  "cluster_grid": 1,
  "router_primitives": [
    {
      "primitive_id": "async_fat_1x2",
      "level": 1,
      "child_lanes": 1,
      "parent_lanes": 2,
      "use_mesh_routing": false,
      "count": 16
    },
    {
      "primitive_id": "async_pfat_2x4",
      "level": 2,
      "child_lanes": 2,
      "parent_lanes": 4,
      "use_mesh_routing": false,
      "count": 4
    },
    {
      "primitive_id": "async_pfat_4x8",
      "level": 3,
      "child_lanes": 4,
      "parent_lanes": 8,
      "use_mesh_routing": false,
      "count": 1
    }
  ],
  "expected_structure": {
    "routers": 21,
    "ports": 168,
    "adapters": 352,
    "interlevel_fifos": 0,
    "top_ports": 8,
    "max_opm_fanin": 20,
    "mutex_widths": [
      2,
      4,
      5,
      8,
      10,
      16,
      20
    ]
  },
  "flit_width_bits": 28,
  "buffer_slots": 5,
  "no_uturn": true,
  "interlevel_fifo": "bypass",
  "clock_ns": null,
  "hrep_policy": false,
  "shares_netlist_with": null,
  "paired_trace_with": null,
  "adapter": null,
  "paper_role": "Asynchronous progressively widened hierarchical network, 64 nodes",
  "paper_eligible_default": true,
  "notes": "",
  "delay_recipe": {
    "rcu_steps": 1,
    "rcu_unit_ps": 50,
    "buf_stages": 0,
    "ackin_steps": 1,
    "ackin_unit_ps": 50,
    "ackin_use_buf": false
  },
  "display_name": "Asynchronous progressively widened hierarchical network, 64 nodes",
  "display_description": "64-node asynchronous hierarchical network that widens upper-level lanes to 1-2-4-8."
}
