{
  "schema": "date-v3-design-v1",
  "design_id": "FPGA_ASYNC_PROP64",
  "kind": "fpga",
  "family": "FPGA",
  "nodes": 64,
  "async": true,
  "routing": "fpga_wrap",
  "lane_profile": "1-2-2-2",
  "top_mesh_lanes": 2,
  "cluster_grid": 1,
  "router_primitives": [],
  "expected_structure": {
    "routers": 21
  },
  "flit_width_bits": 28,
  "buffer_slots": 5,
  "no_uturn": true,
  "interlevel_fifo": "bypass",
  "delay_recipe": {
    "rcu_steps": 1,
    "rcu_unit_ps": 50,
    "buf_stages": 0,
    "ackin_steps": 1,
    "ackin_unit_ps": 50,
    "ackin_use_buf": false
  },
  "clock_ns": null,
  "hrep_policy": false,
  "shares_netlist_with": "PROP64",
  "fpga": {
    "board": null,
    "part": null,
    "vivado": null,
    "host_interface": null,
    "hardware_validation": false
  },
  "adapter": null,
  "paper_role": "Phase 11 64-node hardware validation",
  "paper_eligible_default": false,
  "notes": "Board/part/Vivado must be frozen before bitstream can count as hardware validation.",
  "display_name": "Field-programmable gate-array wrap of the asynchronous balanced hierarchical 64-node network"
}
