{
  "schema": "date-v3-design-v1",
  "design_id": "SYNC_PROP_2X2",
  "kind": "router_primitive",
  "family": "SYNC",
  "nodes": null,
  "async": false,
  "routing": "quadtree",
  "lane_profile": "2-2",
  "top_mesh_lanes": null,
  "cluster_grid": null,
  "router_primitives": [
    {
      "primitive_id": "sync_prop_2x2",
      "level": 2,
      "child_lanes": 2,
      "parent_lanes": 2,
      "use_mesh_routing": false,
      "count": 1
    }
  ],
  "expected_structure": {
    "routers": 1,
    "ports": 10,
    "adapters": 40,
    "interlevel_fifos": 0,
    "top_ports": 0,
    "max_opm_fanin": 8,
    "mutex_widths": []
  },
  "flit_width_bits": 28,
  "buffer_slots": 5,
  "no_uturn": true,
  "interlevel_fifo": "n/a",
  "clock_ns": 1.0,
  "hrep_policy": false,
  "shares_netlist_with": null,
  "adapter": "dc_sync_router",
  "paper_role": "Table I Sync 2x2 counterpart",
  "paper_eligible_default": true,
  "notes": "Table I / calibration primitive. Same CMR microarchitecture; geometry only.",
  "delay_recipe": {
    "rcu_steps": 1,
    "rcu_unit_ps": 50,
    "buf_stages": 0,
    "ackin_steps": 1,
    "ackin_unit_ps": 50,
    "ackin_use_buf": false
  },
  "display_name": "Synchronous balanced hierarchical router primitive"
}
