{
  "schema": "date-v3-design-v1",
  "design_id": "SYNC_THIN64",
  "kind": "network",
  "family": "SYNC",
  "nodes": 64,
  "async": false,
  "routing": "quadtree",
  "lane_profile": "1-1-1-1",
  "top_mesh_lanes": 1,
  "cluster_grid": 1,
  "router_primitives": [
    {
      "primitive_id": "sync_thin_1x1",
      "level": 1,
      "child_lanes": 1,
      "parent_lanes": 1,
      "use_mesh_routing": false,
      "count": 16
    },
    {
      "primitive_id": "sync_thin_1x1",
      "level": 2,
      "child_lanes": 1,
      "parent_lanes": 1,
      "use_mesh_routing": false,
      "count": 4
    },
    {
      "primitive_id": "sync_thin_1x1",
      "level": 3,
      "child_lanes": 1,
      "parent_lanes": 1,
      "use_mesh_routing": false,
      "count": 1
    }
  ],
  "expected_structure": {
    "routers": 21,
    "ports": 105,
    "adapters": 0,
    "interlevel_fifos": 0,
    "top_ports": 1,
    "max_opm_fanin": 4,
    "mutex_widths": [
      4
    ]
  },
  "flit_width_bits": 28,
  "buffer_slots": 5,
  "no_uturn": true,
  "interlevel_fifo": "bypass",
  "clock_ns": 1.0,
  "hrep_policy": false,
  "shares_netlist_with": null,
  "paired_trace_with": "THIN64",
  "adapter": "noc64_sync",
  "paper_role": "Synchronous narrow hierarchical network, 64 nodes; same traces as the asynchronous narrow 64-node network",
  "paper_eligible_default": true,
  "notes": "Phase 2.5 one-cycle head; frozen clock 1.0 ns. Shares case format with the asynchronous narrow 64-node network.",
  "delay_recipe": {
    "rcu_steps": 1,
    "rcu_unit_ps": 50,
    "buf_stages": 0,
    "ackin_steps": 1,
    "ackin_unit_ps": 50,
    "ackin_use_buf": false
  },
  "display_name": "Synchronous narrow hierarchical network, 64 nodes",
  "display_description": "Clocked 64-node narrow hierarchical counterpart of the asynchronous narrow 64-node network. Signed at 1.0 ns with a one-cycle head."
}
